{
  "manifest_version": "1.0",
  "render_id": "launch-teaser-001",
  "composition": "branded-starter",
  "video_path": "output/launch-teaser.mp4",
  "thumbnail_path": "output/launch-teaser.png",
  "duration_seconds": 12,
  "fps": 30,
  "width": 1080,
  "height": 1920,
  "created_at": "2026-05-11T12:00:00Z",
  "warnings": [],
  "source_spec_path": "fixtures/render-spec.valid.json"
}
